{
  "contract_version": "tarot_knowledge_v1",
  "locale": "ru",
  "card_count": 78,
  "cards": [
    {
      "card_id": 0,
      "name_ru": "Шут",
      "central_archetype": "новый шаг в неизвестное без полной карты",
      "light": [
        "открытость опыту",
        "эксперимент",
        "свобода от старого сценария",
        "лёгкость старта"
      ],
      "shadow": [
        "импульсивность",
        "прыжок ради снятия тревоги",
        "отказ готовиться"
      ],
      "inner_conflict": "хочет свободы и боится выглядеть неготовым",
      "outer_expression": "начинает раньше, чем объяснит себе зачем",
      "domains": {
        "relationships": "свежий контакт или готовность рискнуть близостью без гарантий",
        "work": "пилот / новый роль / смена поля без полного плана",
        "money": "ставка на потенциал, а не на уже посчитанный доход",
        "growth": "разрешить себе первый несовершенный шаг"
      },
      "reversed": {
        "central": "прыжок без опоры или застревание в «ещё не готов»",
        "themes": [
          "импульс без подготовки",
          "откладывание старта",
          "наивное повторение цикла"
        ],
        "trap": "либо бросается, либо вечно готовится — оба пути избегают контакта с реальностью"
      },
      "amplifies_questions": [
        "growth",
        "decision",
        "purpose",
        "choice"
      ],
      "intensifies_with": [
        1,
        10,
        16
      ],
      "softens_with": [
        4,
        9,
        14
      ],
      "upright_themes": [
        "открытость опыту",
        "эксперимент",
        "свобода от старого сценария",
        "лёгкость старта"
      ],
      "reversed_themes": [
        "импульс без подготовки",
        "откладывание старта",
        "наивное повторение цикла"
      ]
    },
    {
      "card_id": 1,
      "name_ru": "Маг",
      "central_archetype": "сбор ресурсов в одно направленное действие",
      "light": [
        "фокус",
        "воля",
        "инструменты в руках",
        "связь слова и дела"
      ],
      "shadow": [
        "рассеянность",
        "манипуляция",
        "сомнение в своём влиянии"
      ],
      "inner_conflict": "знает, что может, но сомневается, стоит ли брать ответственность",
      "outer_expression": "собирает средства, людей, навыки в одну линию",
      "domains": {
        "relationships": "инициирует разговор или рамку контакта",
        "work": "запуск, презентация, сбор команды/инструментов",
        "money": "активное использование уже имеющихся рычагов",
        "growth": "перевести намерение в конкретный жест"
      },
      "reversed": {
        "central": "сила есть, но вектор размазан или используется криво",
        "themes": [
          "рассеянная энергия",
          "манипуляция",
          "недоверие к своим инструментам"
        ],
        "trap": "много говорит о возможностях, мало фиксирует один ход"
      },
      "amplifies_questions": [
        "work",
        "decision",
        "purpose",
        "growth"
      ],
      "intensifies_with": [
        0,
        7,
        19
      ],
      "softens_with": [
        2,
        9,
        14
      ],
      "upright_themes": [
        "фокус",
        "воля",
        "инструменты в руках",
        "связь слова и дела"
      ],
      "reversed_themes": [
        "рассеянная энергия",
        "манипуляция",
        "недоверие к своим инструментам"
      ]
    },
    {
      "card_id": 2,
      "name_ru": "Верховная Жрица",
      "central_archetype": "знание под поверхностью; пауза перед проявленным ответом",
      "light": [
        "интуиция",
        "тишина",
        "внутреннее знание",
        "хранение границы"
      ],
      "shadow": [
        "закрытость",
        "молчание вместо ясности",
        "недоверие к сигналу"
      ],
      "inner_conflict": "чувствует правду раньше, чем может её объяснить",
      "outer_expression": "держит паузу, читает скрытые сигналы, не спешит открываться",
      "domains": {
        "relationships": "нужна честность без давления; важно то, что не сказано",
        "work": "стратегия «ещё не раскрывать»; наблюдение за полем",
        "money": "не вкладываться в то, что не резонирует телом",
        "growth": "доверять тихому знанию без требования доказательств"
      },
      "reversed": {
        "central": "сигнал глушится или прячется от себя",
        "themes": [
          "игнор интуиции",
          "закрытость",
          "секрет как контроль"
        ],
        "trap": "молчит так долго, что ситуация решает за него"
      },
      "amplifies_questions": [
        "inner_state",
        "relationships",
        "decision",
        "undefined"
      ],
      "intensifies_with": [
        18,
        9,
        17
      ],
      "softens_with": [
        1,
        19,
        4
      ],
      "upright_themes": [
        "интуиция",
        "тишина",
        "внутреннее знание",
        "хранение границы"
      ],
      "reversed_themes": [
        "игнор интуиции",
        "закрытость",
        "секрет как контроль"
      ]
    },
    {
      "card_id": 3,
      "name_ru": "Императрица",
      "central_archetype": "опора, рост и телесная щедрость формы",
      "light": [
        "забота",
        "плодородие",
        "телесность",
        "создание условий"
      ],
      "shadow": [
        "истощение от отдачи",
        "перегруз заботой",
        "зависимость от «быть нужной»"
      ],
      "inner_conflict": "хочет питать жизнь и боится опустошиться",
      "outer_expression": "создаёт среду, где что-то может вырасти",
      "domains": {
        "relationships": "тепло, поддержка, телесный/бытовой контакт",
        "work": "выращивание продукта, команды, условий",
        "money": "изобилие через заботу о базе, не через гонку",
        "growth": "разрешить себе получать, а не только отдавать"
      },
      "reversed": {
        "central": "отдача без восполнения или творческий застой",
        "themes": [
          "истощение",
          "отдавать больше, чем получать",
          "застой творчества"
        ],
        "trap": "держит всех на плаву ценой собственной опоры"
      },
      "amplifies_questions": [
        "relationships",
        "growth",
        "money",
        "inner_state"
      ],
      "intensifies_with": [
        19,
        17,
        21
      ],
      "softens_with": [
        4,
        15,
        13
      ],
      "upright_themes": [
        "забота",
        "плодородие",
        "телесность",
        "создание условий"
      ],
      "reversed_themes": [
        "истощение",
        "отдавать больше, чем получать",
        "застой творчества"
      ]
    },
    {
      "card_id": 4,
      "name_ru": "Император",
      "central_archetype": "структура, границы и ответственность за порядок",
      "light": [
        "ясные правила",
        "ответственность",
        "стабильный каркас",
        "защита территории"
      ],
      "shadow": [
        "жёсткость",
        "контроль вместо диалога",
        "страх хаоса"
      ],
      "inner_conflict": "безопасность через контроль структуры",
      "outer_expression": "задаёт рамки, роли, сроки, иерархию",
      "domains": {
        "relationships": "нужны договорённости и уважение границ",
        "work": "управление, система, фиксация правил",
        "money": "бюджет, план, контроль риска",
        "growth": "отличать опору от жёсткости"
      },
      "reversed": {
        "central": "контроль подменяет заботу о смысле",
        "themes": [
          "тирания правил",
          "потеря гибкости",
          "отказ от ответственности"
        ],
        "trap": "либо давит рамкой, либо бросает рамку совсем"
      },
      "amplifies_questions": [
        "work",
        "decision",
        "money",
        "conflict"
      ],
      "intensifies_with": [
        5,
        11,
        16
      ],
      "softens_with": [
        0,
        3,
        14
      ],
      "upright_themes": [
        "ясные правила",
        "ответственность",
        "стабильный каркас",
        "защита территории"
      ],
      "reversed_themes": [
        "тирания правил",
        "потеря гибкости",
        "отказ от ответственности"
      ]
    },
    {
      "card_id": 5,
      "name_ru": "Иерофант",
      "central_archetype": "ценности, учение и свои/чужие «как надо»",
      "light": [
        "свои принципы",
        "передача смысла",
        "опора на традицию",
        "этический каркас"
      ],
      "shadow": [
        "догма",
        "чужие правила вместо своих",
        "стыд за отклонение"
      ],
      "inner_conflict": "хочет принадлежать смыслу и боится выйти из нормы",
      "outer_expression": "ссылается на правила, учителей, «правильный путь»",
      "domains": {
        "relationships": "вопрос общих ценностей и допустимого",
        "work": "нормы команды, наставничество, политика",
        "money": "«правильные» вложения vs свои критерии",
        "growth": "отличить живую ценность от чужой догмы"
      },
      "reversed": {
        "central": "бунт против формы или слепое следование",
        "themes": [
          "чужие «как надо»",
          "ломание правил без опоры",
          "догма"
        ],
        "trap": "либо подчиняется норме, либо ломает её назло — без своей оси"
      },
      "amplifies_questions": [
        "purpose",
        "work",
        "decision",
        "growth"
      ],
      "intensifies_with": [
        4,
        6,
        20
      ],
      "softens_with": [
        0,
        12,
        17
      ],
      "upright_themes": [
        "свои принципы",
        "передача смысла",
        "опора на традицию",
        "этический каркас"
      ],
      "reversed_themes": [
        "чужие «как надо»",
        "ломание правил без опоры",
        "догма"
      ]
    },
    {
      "card_id": 6,
      "name_ru": "Влюблённые",
      "central_archetype": "честный выбор сердца и согласование желания",
      "light": [
        "назвать желание",